{
  "schema_version": "1.0",
  "skill_name": "product-usage-outreach",
  "skill_version": "0.1.0-dev",
  "canonical_content_hash": null,
  "updated_at": "2026-09-03T00:00:00Z",
  "targets": [
    {
      "target": "codex-local",
      "package_form": "canonical-directory",
      "status": "untested",
      "tested_at": null,
      "tested_product_version": null,
      "operating_modes": [],
      "persistence_strategy": "unknown",
      "limitations": ["Runtime conformance has not been executed."],
      "evidence": [],
      "invalidation_triggers": ["host-version-change", "package-change", "schema-change", "runtime-contract-change", "persistence-change", "installation-path-change"]
    },
    {
      "target": "claude-code-local",
      "package_form": "generated-directory",
      "status": "untested",
      "tested_at": null,
      "tested_product_version": null,
      "operating_modes": [],
      "persistence_strategy": "unknown",
      "limitations": ["Runtime conformance has not been executed."],
      "evidence": [],
      "invalidation_triggers": ["host-version-change", "package-change", "schema-change", "runtime-contract-change", "persistence-change", "installation-path-change"]
    },
    {
      "target": "chatgpt-app",
      "package_form": "api-managed",
      "status": "untested",
      "tested_at": null,
      "tested_product_version": null,
      "operating_modes": [],
      "persistence_strategy": "unknown",
      "limitations": ["Installation path and runtime capabilities require release-time verification."],
      "evidence": [],
      "invalidation_triggers": ["host-version-change", "package-change", "schema-change", "runtime-contract-change", "persistence-change", "installation-path-change"]
    },
    {
      "target": "claude-app",
      "package_form": "zip",
      "status": "untested",
      "tested_at": null,
      "tested_product_version": null,
      "operating_modes": [],
      "persistence_strategy": "unknown",
      "limitations": ["Installation path and runtime capabilities require release-time verification."],
      "evidence": [],
      "invalidation_triggers": ["host-version-change", "package-change", "schema-change", "runtime-contract-change", "persistence-change", "installation-path-change"]
    }
  ]
}
